{
  "schema_version": "1.0",
  "provider": "google_drive",
  "ticket_id": "33333333-3333-4333-8333-333333333333",
  "session_id": "11111111-1111-4111-8111-111111111111",
  "expires_at": "2026-08-17T04:15:00Z",
  "max_bytes": 536870912,
  "mime_type": "application/zip",
  "method": "BROKERED_UPLOAD"
}
